{
  "page_id": "project.tree",
  "scene_key": "project.list",
  "client_type": "web_pc",
  "etag": "lite-project-tree-adapter-source-001",
  "trace_id": "trace.lite.adapter.project.tree.001",
  "render_profile": "readonly",
  "semantic_page": {
    "model": "project.project",
    "view_type": "tree",
    "layout": "auto",
    "permission_verdicts": {
      "read": {"allowed": true, "reason_code": "OK"},
      "create": {"allowed": false, "reason_code": "PERMISSION_DENIED"},
      "write": {"allowed": false, "reason_code": "PERMISSION_DENIED"},
      "unlink": {"allowed": false, "reason_code": "PERMISSION_DENIED"},
      "execute": {"allowed": true, "reason_code": "OK"}
    },
    "actions": {
      "header_actions": [],
      "record_actions": [
        {"key": "open", "label": "打开", "enabled": true, "reason_code": "OK"},
        {"key": "archive", "label": "归档", "enabled": false, "reason_code": "PERMISSION_DENIED"}
      ],
      "toolbar_actions": []
    },
    "zones": [
      {
        "key": "detail_zone",
        "blocks": [
          {
            "type": "field_group_block",
            "data": {
              "columns": ["name", "manager_id", "stage_id"]
            }
          }
        ]
      }
    ]
  },
  "fields": {
    "name": {"type": "char", "label": "项目名称", "required": true},
    "manager_id": {"type": "many2one", "label": "项目经理", "required": false},
    "stage_id": {"type": "many2one", "label": "项目阶段", "required": false}
  },
  "field_policies": {
    "name": {"visible_profiles": ["readonly"], "readonly_profiles": ["readonly"]},
    "manager_id": {"visible_profiles": ["readonly"], "readonly_profiles": ["readonly"]},
    "stage_id": {"visible_profiles": ["readonly"], "readonly_profiles": ["readonly"]}
  },
  "action_policies": {
    "open": {"visible": true, "enabled": true},
    "archive": {"visible": true, "enabled": false}
  },
  "access_policy": {
    "mode": "degrade",
    "reason_code": "RELATION_READ_FORBIDDEN",
    "blocked_fields": [],
    "degraded_fields": [
      {"field": "manager_id", "model": "res.users", "reason_code": "RELATION_READ_FORBIDDEN"}
    ]
  },
  "record": {},
  "relation_rows": {},
  "dict_data": {}
}
